{
  "$schema": "../../../../schemas/adapters/adapter-record.schema.json",
  "id": "fotodiox-hbv-nkz-p",
  "identity": {
    "manufacturerId": "fotodiox",
    "brandId": "fotodiox",
    "productName": "Fotodiox Pro Lens Mount Adapter Compatible with Hasselblad V-Mount SLR Lenses to Nikon Z-Mount Mirrorless Camera Bodies",
    "modelNumberOptions": null,
    "alternateNames": null,
    "variants": null
  },
  "lifecycle": {
    "announcementDate": null,
    "officialDesignations": []
  },
  "officialProductPages": [
    {
      "url": "https://fotodioxpro.com/products/hbv-nkz-p",
      "pageFamilies": [
        "global"
      ],
      "region": null,
      "language": "en",
      "publisher": {
        "type": "manufacturer-or-brand",
        "name": "Fotodiox"
      }
    }
  ],
  "mountConfigurations": [
    {
      "lensSideMountSystemId": "hasselblad-v",
      "cameraSideMountSystemId": "nikon-z",
      "lensRetention": null,
      "lensRearProtrusionLimits": null
    }
  ],
  "electronics": {
    "electronicContacts": false,
    "autofocus": false,
    "cameraControlledAperture": false,
    "lensStabilizationCommunication": false,
    "manualFocusAssistance": false,
    "metadataTransmission": {
      "present": false
    },
    "lensPowerTransmission": false,
    "recordingTriggerTransmission": false
  },
  "mechanisms": [],
  "physical": {
    "dimensionMeasurements": null,
    "weightMeasurements": null,
    "officialEnvironmentalProtectionClaims": null,
    "tripodSupport": null
  },
  "electronicServices": null,
  "conversionOptics": {
    "present": false
  }
}
