{
  "$schema": "../../../../schemas/adapters/adapter-record.schema.json",
  "id": "shoten-se-nz",
  "identity": {
    "manufacturerId": "shoten-kobo",
    "brandId": "shoten",
    "productName": "SHOTEN SE-NZ Mount Adapter",
    "modelNumberOptions": [
      "SE-NZ"
    ],
    "alternateNames": null,
    "variants": null
  },
  "lifecycle": {
    "announcementDate": "2019-09-05",
    "officialDesignations": null
  },
  "officialProductPages": [
    {
      "url": "https://www.stkb.jp/shopdetail/000000001287",
      "pageFamilies": [
        "home-country"
      ],
      "region": "JP",
      "language": "ja",
      "publisher": {
        "type": "manufacturer-or-brand",
        "name": "SHOTEN"
      }
    }
  ],
  "mountConfigurations": [
    {
      "lensSideMountSystemId": "sony-e",
      "cameraSideMountSystemId": "nikon-z",
      "lensRetention": null,
      "lensRearProtrusionLimits": null
    }
  ],
  "electronics": {
    "electronicContacts": false,
    "autofocus": false,
    "cameraControlledAperture": false,
    "lensStabilizationCommunication": false,
    "manualFocusAssistance": false,
    "metadataTransmission": {
      "present": false
    },
    "lensPowerTransmission": false,
    "recordingTriggerTransmission": false
  },
  "mechanisms": null,
  "physical": {
    "dimensionMeasurements": null,
    "weightMeasurements": null,
    "officialEnvironmentalProtectionClaims": null,
    "tripodSupport": null
  },
  "electronicServices": null,
  "conversionOptics": {
    "present": false
  }
}
