{
  "$schema": "../../../../schemas/adapters/adapter-record.schema.json",
  "id": "fotodiox-ar-nkz-p",
  "identity": {
    "manufacturerId": "fotodiox",
    "brandId": "fotodiox",
    "productName": "Fotodiox Pro Lens Mount Adapter Compatible with Konica Auto-Reflex (AR) SLR Lenses to Nikon Z-Mount Mirrorless Camera Bodies",
    "modelNumberOptions": null,
    "alternateNames": null,
    "variants": null
  },
  "lifecycle": {
    "announcementDate": null,
    "officialDesignations": []
  },
  "officialProductPages": [
    {
      "url": "https://fotodioxpro.com/products/ar-nkz-p",
      "pageFamilies": [
        "global"
      ],
      "region": null,
      "language": "en",
      "publisher": {
        "type": "manufacturer-or-brand",
        "name": "Fotodiox"
      }
    }
  ],
  "mountConfigurations": [
    {
      "lensSideMountSystemId": "konica-ar",
      "cameraSideMountSystemId": "nikon-z",
      "lensRetention": null,
      "lensRearProtrusionLimits": null
    }
  ],
  "electronics": {
    "electronicContacts": false,
    "autofocus": false,
    "cameraControlledAperture": false,
    "lensStabilizationCommunication": false,
    "manualFocusAssistance": false,
    "metadataTransmission": {
      "present": false
    },
    "lensPowerTransmission": false,
    "recordingTriggerTransmission": false
  },
  "mechanisms": [],
  "physical": {
    "dimensionMeasurements": [
      {
        "unclassifiedDimensionsMm": [
          65,
          78,
          29
        ],
        "conditions": {}
      }
    ],
    "weightMeasurements": [
      {
        "grams": 119,
        "conditions": {},
        "approximate": true
      }
    ],
    "officialEnvironmentalProtectionClaims": null,
    "tripodSupport": {
      "present": true,
      "components": [
        {
          "type": "foot",
          "relationship": null,
          "removable": null,
          "interfaces": null,
          "modelNumberOptions": null,
          "quantity": null,
          "conditions": {}
        }
      ]
    }
  },
  "electronicServices": null,
  "conversionOptics": {
    "present": false
  }
}
