{
  "$schema": "../../../../schemas/adapters/adapter-record.schema.json",
  "id": "shoten-pl-nz-u",
  "identity": {
    "manufacturerId": "shoten-kobo",
    "brandId": "shoten",
    "productName": "SHOTEN PL-NZ-U Mount Adapter",
    "modelNumberOptions": [
      "PL-NZ-U"
    ],
    "alternateNames": null,
    "variants": null
  },
  "lifecycle": {
    "announcementDate": "2023-03-22",
    "officialDesignations": null
  },
  "officialProductPages": [],
  "mountConfigurations": [
    {
      "lensSideMountSystemId": "arri-pl",
      "cameraSideMountSystemId": "nikon-z",
      "lensRetention": {
        "type": "positive-lock"
      },
      "lensRearProtrusionLimits": null
    }
  ],
  "electronics": {
    "electronicContacts": null,
    "autofocus": null,
    "cameraControlledAperture": null,
    "lensStabilizationCommunication": null,
    "manualFocusAssistance": null,
    "metadataTransmission": null,
    "lensPowerTransmission": null,
    "recordingTriggerTransmission": null
  },
  "mechanisms": null,
  "physical": {
    "dimensionMeasurements": null,
    "weightMeasurements": null,
    "officialEnvironmentalProtectionClaims": null,
    "tripodSupport": null
  },
  "electronicServices": null,
  "conversionOptics": {
    "present": false
  }
}
