{
  "$schema": "../../../../schemas/adapters/adapter-record.schema.json",
  "id": "pholsy-adaptall-nz",
  "identity": {
    "manufacturerId": "pholsy",
    "brandId": "pholsy",
    "productName": "PHOLSY Lens Mount Adapter Manual Focus Compatible with Tamron ADAPTALL-2 Mount Lens to Nikon Z Mount Camera Body",
    "modelNumberOptions": null,
    "alternateNames": null,
    "variants": null
  },
  "lifecycle": {
    "announcementDate": null,
    "officialDesignations": []
  },
  "officialProductPages": [
    {
      "url": "https://pholsy.com/products/pholsy-lens-mount-adapter-manual-focus-compatible-with-tamron-adaptall-2-mount-lens-to-nikon-z-mount-camera-body",
      "pageFamilies": [
        "global"
      ],
      "region": null,
      "language": "en",
      "publisher": {
        "type": "manufacturer-or-brand",
        "name": "PHOLSY"
      }
    }
  ],
  "mountConfigurations": [
    {
      "lensSideMountSystemId": "tamron-adaptall",
      "cameraSideMountSystemId": "nikon-z",
      "lensRetention": null,
      "lensRearProtrusionLimits": null
    }
  ],
  "electronics": {
    "electronicContacts": false,
    "autofocus": false,
    "cameraControlledAperture": false,
    "lensStabilizationCommunication": false,
    "manualFocusAssistance": false,
    "metadataTransmission": {
      "present": false
    },
    "lensPowerTransmission": false,
    "recordingTriggerTransmission": false
  },
  "mechanisms": [],
  "physical": {
    "dimensionMeasurements": null,
    "weightMeasurements": null,
    "officialEnvironmentalProtectionClaims": null,
    "tripodSupport": null
  },
  "electronicServices": null,
  "conversionOptics": {
    "present": false
  }
}
