{
  "$schema": "../../../../schemas/adapters/adapter-record.schema.json",
  "id": "big-421239",
  "identity": {
    "manufacturerId": "brenner-import",
    "brandId": "big",
    "productName": "B.I.G. Objektivadapter M42 an Nikon Z",
    "modelNumberOptions": null,
    "alternateNames": null,
    "variants": null
  },
  "lifecycle": {
    "announcementDate": null,
    "officialDesignations": []
  },
  "officialProductPages": [
    {
      "url": "https://www.big-photo.de/b.i.g.-objektivadapter-m42-an-nikon-z",
      "pageFamilies": [
        "home-country"
      ],
      "region": "DE",
      "language": "de",
      "publisher": {
        "type": "manufacturer-or-brand",
        "name": "B.I.G."
      }
    }
  ],
  "mountConfigurations": [
    {
      "lensSideMountSystemId": "m42",
      "cameraSideMountSystemId": "nikon-z",
      "lensRetention": null,
      "lensRearProtrusionLimits": null
    }
  ],
  "electronics": {
    "electronicContacts": false,
    "autofocus": false,
    "cameraControlledAperture": false,
    "lensStabilizationCommunication": false,
    "manualFocusAssistance": false,
    "metadataTransmission": {
      "present": false
    },
    "lensPowerTransmission": false,
    "recordingTriggerTransmission": false
  },
  "mechanisms": [],
  "physical": {
    "dimensionMeasurements": null,
    "weightMeasurements": null,
    "officialEnvironmentalProtectionClaims": null,
    "tripodSupport": null
  },
  "electronicServices": null,
  "conversionOptics": {
    "present": false
  }
}
