{
  "$schema": "../../../../schemas/adapters/adapter-record.schema.json",
  "id": "7artisans-ef-nz",
  "identity": {
    "manufacturerId": "7artisans",
    "brandId": "7artisans",
    "productName": "EF-NZ Autofocus Adapter",
    "modelNumberOptions": [
      "EF-NZ"
    ],
    "alternateNames": null,
    "variants": null
  },
  "lifecycle": {
    "announcementDate": null,
    "officialDesignations": []
  },
  "officialProductPages": [
    {
      "url": "https://www.7artisans.com/prod_view.aspx?id=440&nid=3&typeid=96",
      "pageFamilies": [
        "global"
      ],
      "region": null,
      "language": "en",
      "publisher": {
        "type": "manufacturer-or-brand",
        "name": "7Artisans"
      }
    }
  ],
  "mountConfigurations": [
    {
      "lensSideMountSystemId": "canon-ef",
      "cameraSideMountSystemId": "nikon-z",
      "lensRetention": null,
      "lensRearProtrusionLimits": null
    }
  ],
  "electronics": {
    "electronicContacts": true,
    "autofocus": true,
    "cameraControlledAperture": true,
    "lensStabilizationCommunication": true,
    "manualFocusAssistance": null,
    "metadataTransmission": {
      "present": true,
      "standards": [
        "exif"
      ]
    },
    "lensPowerTransmission": null,
    "recordingTriggerTransmission": null
  },
  "mechanisms": [],
  "physical": {
    "dimensionMeasurements": null,
    "weightMeasurements": [
      {
        "grams": 130,
        "conditions": {}
      }
    ],
    "officialEnvironmentalProtectionClaims": null,
    "tripodSupport": null
  },
  "electronicServices": {
    "hasPublishedFirmwareUpdate": true,
    "connections": null
  },
  "conversionOptics": {
    "present": false
  }
}
