{
  "$schema": "../../../../schemas/adapters/adapter-record.schema.json",
  "id": "techart-tzm-02",
  "identity": {
    "manufacturerId": "techart",
    "brandId": "techart",
    "productName": "Leica M to Nikon Z Autofocus Adapter Version II",
    "modelNumberOptions": [
      "TZM-02"
    ],
    "alternateNames": null,
    "variants": null
  },
  "lifecycle": {
    "announcementDate": null,
    "officialDesignations": []
  },
  "officialProductPages": [
    {
      "url": "https://techartpro.com/?product=techart-pro-leica-m-nikon-z-autofocus-adapter-ver-ii-tzm02",
      "pageFamilies": [
        "global"
      ],
      "region": null,
      "language": "en",
      "publisher": {
        "type": "manufacturer-or-brand",
        "name": "TECHART"
      }
    }
  ],
  "mountConfigurations": [
    {
      "lensSideMountSystemId": "leica-m",
      "cameraSideMountSystemId": "nikon-z",
      "lensRetention": null,
      "lensRearProtrusionLimits": null
    }
  ],
  "electronics": {
    "electronicContacts": true,
    "autofocus": true,
    "cameraControlledAperture": false,
    "lensStabilizationCommunication": false,
    "manualFocusAssistance": true,
    "metadataTransmission": null,
    "lensPowerTransmission": null,
    "recordingTriggerTransmission": null
  },
  "mechanisms": [
    {
      "type": "helicoid",
      "conditions": {}
    }
  ],
  "physical": {
    "dimensionMeasurements": null,
    "weightMeasurements": null,
    "officialEnvironmentalProtectionClaims": null,
    "tripodSupport": null
  },
  "electronicServices": {
    "hasPublishedFirmwareUpdate": true,
    "connections": [
      {
        "method": "dock",
        "purposes": [
          "firmware-update"
        ]
      },
      {
        "method": "camera-body",
        "purposes": [
          "configuration"
        ]
      }
    ]
  },
  "conversionOptics": {
    "present": false
  }
}
