{
  "$schema": "../../../../schemas/adapters/adapter-record.schema.json",
  "id": "rayqual-sc-nz-o",
  "identity": {
    "manufacturerId": "rayqual",
    "brandId": "rayqual",
    "productName": "Nikon S / Contax C Outer-Bayonet Lens Mount Adapter for Nikon Z",
    "modelNumberOptions": [
      "SC-NZ.O"
    ],
    "alternateNames": null,
    "variants": null
  },
  "lifecycle": {
    "announcementDate": null,
    "officialDesignations": []
  },
  "officialProductPages": [],
  "mountConfigurations": [
    {
      "lensSideMountSystemId": "contax-rangefinder",
      "cameraSideMountSystemId": "nikon-z",
      "lensRetention": null,
      "lensRearProtrusionLimits": null
    }
  ],
  "electronics": {
    "electronicContacts": false,
    "autofocus": false,
    "cameraControlledAperture": false,
    "lensStabilizationCommunication": false,
    "manualFocusAssistance": false,
    "metadataTransmission": {
      "present": false
    },
    "lensPowerTransmission": false,
    "recordingTriggerTransmission": false
  },
  "mechanisms": null,
  "physical": {
    "dimensionMeasurements": null,
    "weightMeasurements": null,
    "officialEnvironmentalProtectionClaims": null,
    "tripodSupport": null
  },
  "electronicServices": null,
  "conversionOptics": {
    "present": false
  }
}
