{
  "$schema": "../../../../schemas/adapters/adapter-record.schema.json",
  "id": "kf-concept-kf06-374",
  "identity": {
    "manufacturerId": "kf-concept",
    "brandId": "kf-concept",
    "productName": "Minolta MD Lenses to Nikon Z Mount Camera Adapter",
    "modelNumberOptions": [
      "KF06.374",
      "KF-SRZ"
    ],
    "alternateNames": null,
    "variants": null
  },
  "lifecycle": {
    "announcementDate": null,
    "officialDesignations": []
  },
  "officialProductPages": [
    {
      "url": "https://www.kentfaith.co.uk/KF06.374_minolta-md-lenses-to-nikon-z-mount-camera-adapter",
      "pageFamilies": [
        "global"
      ],
      "region": "GB",
      "language": "en",
      "publisher": {
        "type": "manufacturer-or-brand",
        "name": "K&F CONCEPT"
      }
    }
  ],
  "mountConfigurations": [
    {
      "lensSideMountSystemId": "minolta-sr",
      "cameraSideMountSystemId": "nikon-z",
      "lensRetention": null,
      "lensRearProtrusionLimits": null
    }
  ],
  "electronics": {
    "electronicContacts": false,
    "autofocus": false,
    "cameraControlledAperture": false,
    "lensStabilizationCommunication": false,
    "manualFocusAssistance": false,
    "metadataTransmission": {
      "present": false
    },
    "lensPowerTransmission": false,
    "recordingTriggerTransmission": false
  },
  "mechanisms": [],
  "physical": {
    "dimensionMeasurements": null,
    "weightMeasurements": null,
    "officialEnvironmentalProtectionClaims": null,
    "tripodSupport": null
  },
  "electronicServices": null,
  "conversionOptics": {
    "present": false
  }
}
