{
  "$schema": "../../../../schemas/adapters/adapter-record.schema.json",
  "id": "viltrox-e-z",
  "identity": {
    "manufacturerId": "viltrox",
    "brandId": "viltrox",
    "productName": "E-Z AF Lens Mount Adapter",
    "modelNumberOptions": [
      "E-Z"
    ],
    "alternateNames": null,
    "variants": null
  },
  "lifecycle": {
    "announcementDate": null,
    "officialDesignations": []
  },
  "officialProductPages": [
    {
      "url": "https://viltrox.com/products/viltrox-e-z-af-lens-adapter",
      "pageFamilies": [
        "global"
      ],
      "region": null,
      "language": "en",
      "publisher": {
        "type": "manufacturer-or-brand",
        "name": "VILTROX"
      }
    }
  ],
  "mountConfigurations": [
    {
      "lensSideMountSystemId": "sony-e",
      "cameraSideMountSystemId": "nikon-z",
      "lensRetention": null,
      "lensRearProtrusionLimits": null
    }
  ],
  "electronics": {
    "electronicContacts": true,
    "autofocus": true,
    "cameraControlledAperture": true,
    "lensStabilizationCommunication": true,
    "manualFocusAssistance": true,
    "metadataTransmission": {
      "present": true,
      "standards": [
        "exif"
      ]
    },
    "lensPowerTransmission": null,
    "recordingTriggerTransmission": null
  },
  "mechanisms": [],
  "physical": {
    "dimensionMeasurements": [
      {
        "maximumDiameterMm": 64.5,
        "lengthMm": 7,
        "conditions": {}
      }
    ],
    "weightMeasurements": [
      {
        "grams": 50,
        "conditions": {}
      }
    ],
    "officialEnvironmentalProtectionClaims": null,
    "tripodSupport": null
  },
  "electronicServices": {
    "hasPublishedFirmwareUpdate": true,
    "connections": [
      {
        "method": "direct-usb",
        "purposes": [
          "firmware-update"
        ]
      }
    ]
  },
  "conversionOptics": {
    "present": false
  }
}
