{
  "$schema": "../../../../schemas/adapters/adapter-record.schema.json",
  "id": "c7adapters-nikon-f-nikon-z",
  "identity": {
    "manufacturerId": "c7adapters",
    "brandId": "c7adapters",
    "productName": "Nikon F – Nikon Z",
    "modelNumberOptions": null,
    "alternateNames": null,
    "variants": null
  },
  "lifecycle": {
    "announcementDate": null,
    "officialDesignations": []
  },
  "officialProductPages": [
    {
      "url": "https://c7adapters.com/adapters/nikon-z/nikon-f-nikon-z/",
      "pageFamilies": [
        "global"
      ],
      "region": null,
      "language": "en",
      "publisher": {
        "type": "manufacturer-or-brand",
        "name": "c7Adapters"
      }
    }
  ],
  "mountConfigurations": [
    {
      "lensSideMountSystemId": "nikon-f",
      "cameraSideMountSystemId": "nikon-z",
      "lensRetention": {
        "type": "positive-lock"
      },
      "lensRearProtrusionLimits": null
    }
  ],
  "electronics": {
    "electronicContacts": false,
    "autofocus": false,
    "cameraControlledAperture": false,
    "lensStabilizationCommunication": false,
    "manualFocusAssistance": false,
    "metadataTransmission": {
      "present": false
    },
    "lensPowerTransmission": false,
    "recordingTriggerTransmission": false
  },
  "mechanisms": [
    {
      "type": "aperture-ring",
      "conditions": {}
    },
    {
      "type": "flange-focal-distance-adjustment",
      "conditions": {}
    }
  ],
  "physical": {
    "dimensionMeasurements": null,
    "weightMeasurements": null,
    "officialEnvironmentalProtectionClaims": null,
    "tripodSupport": {
      "present": true,
      "components": [
        {
          "type": "foot",
          "relationship": null,
          "removable": null,
          "interfaces": [
            {
              "type": "mounting-thread",
              "threadDesignation": "1/4 inch"
            }
          ],
          "modelNumberOptions": null,
          "quantity": null,
          "conditions": {}
        }
      ]
    }
  },
  "electronicServices": null,
  "conversionOptics": {
    "present": false
  }
}
