{
  "$schema": "../../../../schemas/adapters/adapter-record.schema.json",
  "id": "kipon-n-g-nik-z-m",
  "identity": {
    "manufacturerId": "kipon",
    "brandId": "kipon",
    "productName": "N/G-NIK Z M with Helicoid",
    "modelNumberOptions": null,
    "alternateNames": null,
    "variants": null
  },
  "lifecycle": {
    "announcementDate": null,
    "officialDesignations": []
  },
  "officialProductPages": [
    {
      "url": "https://www.kipon.jp/products/n-g-nik-z-m-with-helicoid",
      "pageFamilies": [
        "japan"
      ],
      "region": "JP",
      "language": "ja",
      "publisher": {
        "type": "manufacturer-or-brand",
        "name": "KIPON"
      }
    }
  ],
  "mountConfigurations": [
    {
      "lensSideMountSystemId": "nikon-f",
      "cameraSideMountSystemId": "nikon-z",
      "lensRetention": null,
      "lensRearProtrusionLimits": null
    }
  ],
  "electronics": {
    "electronicContacts": false,
    "autofocus": false,
    "cameraControlledAperture": false,
    "lensStabilizationCommunication": false,
    "manualFocusAssistance": false,
    "metadataTransmission": {
      "present": false
    },
    "lensPowerTransmission": false,
    "recordingTriggerTransmission": false
  },
  "mechanisms": [
    {
      "type": "aperture-ring",
      "conditions": {}
    },
    {
      "type": "helicoid",
      "conditions": {}
    }
  ],
  "physical": {
    "dimensionMeasurements": null,
    "weightMeasurements": null,
    "officialEnvironmentalProtectionClaims": null,
    "tripodSupport": null
  },
  "electronicServices": null,
  "conversionOptics": {
    "present": false
  }
}
