{
  "$schema": "../../../../schemas/adapters/adapter-record.schema.json",
  "id": "denz-pl-adapter-nikon-z",
  "identity": {
    "manufacturerId": "denz",
    "brandId": "denz",
    "productName": "PL-Adapter for Nikon Z-mount cameras",
    "modelNumberOptions": [
      "C0100303"
    ],
    "alternateNames": null,
    "variants": null
  },
  "lifecycle": {
    "announcementDate": null,
    "officialDesignations": null
  },
  "officialProductPages": [],
  "mountConfigurations": [
    {
      "lensSideMountSystemId": "arri-pl",
      "cameraSideMountSystemId": "nikon-z",
      "lensRetention": {
        "type": "positive-lock"
      },
      "lensRearProtrusionLimits": null
    }
  ],
  "electronics": {
    "electronicContacts": false,
    "autofocus": false,
    "cameraControlledAperture": false,
    "lensStabilizationCommunication": false,
    "manualFocusAssistance": false,
    "metadataTransmission": {
      "present": false
    },
    "lensPowerTransmission": false,
    "recordingTriggerTransmission": false
  },
  "mechanisms": [],
  "physical": {
    "dimensionMeasurements": null,
    "weightMeasurements": null,
    "officialEnvironmentalProtectionClaims": null,
    "tripodSupport": null
  },
  "electronicServices": null,
  "conversionOptics": {
    "present": false
  }
}
