{
  "$schema": "../../../../schemas/adapters/adapter-record.schema.json",
  "id": "meike-mk-eftz-b",
  "identity": {
    "manufacturerId": "meike",
    "brandId": "meike",
    "productName": "Auto-Focus Mount Adapter for Canon EF/EF-S Lenses to Nikon Z Cameras",
    "modelNumberOptions": [
      "MK-EFTZ-B"
    ],
    "alternateNames": null,
    "variants": null
  },
  "lifecycle": {
    "announcementDate": null,
    "officialDesignations": null
  },
  "officialProductPages": [
    {
      "url": "https://meikeglobal.com/products/auto-focus-mount-adapter-ef-z",
      "pageFamilies": [
        "global"
      ],
      "region": null,
      "language": "en",
      "publisher": {
        "type": "manufacturer-or-brand",
        "name": "Meike"
      }
    }
  ],
  "mountConfigurations": [
    {
      "lensSideMountSystemId": "canon-ef",
      "cameraSideMountSystemId": "nikon-z",
      "lensRetention": null,
      "lensRearProtrusionLimits": null
    }
  ],
  "electronics": {
    "electronicContacts": true,
    "autofocus": true,
    "cameraControlledAperture": true,
    "lensStabilizationCommunication": true,
    "manualFocusAssistance": true,
    "metadataTransmission": {
      "present": true,
      "standards": [
        "exif"
      ]
    },
    "lensPowerTransmission": null,
    "recordingTriggerTransmission": null
  },
  "mechanisms": [
    {
      "type": "other",
      "conditions": {}
    }
  ],
  "physical": {
    "dimensionMeasurements": [
      {
        "maximumDiameterMm": 69,
        "lengthMm": 28.3,
        "conditions": {}
      }
    ],
    "weightMeasurements": [
      {
        "grams": 87,
        "conditions": {}
      }
    ],
    "officialEnvironmentalProtectionClaims": [
      {
        "types": [
          "dust-resistant",
          "other"
        ],
        "scope": {
          "kind": "product"
        },
        "conditions": {}
      }
    ],
    "tripodSupport": null
  },
  "electronicServices": {
    "hasPublishedFirmwareUpdate": true,
    "connections": [
      {
        "method": "direct-usb",
        "connectorType": "usb-c",
        "purposes": [
          "firmware-update"
        ]
      }
    ]
  },
  "conversionOptics": {
    "present": false
  }
}
