{
  "$schema": "../../../../schemas/adapters/adapter-record.schema.json",
  "id": "shoten-fz1",
  "identity": {
    "manufacturerId": "shoten-kobo",
    "brandId": "shoten",
    "productName": "SHOTEN FZ1 Mount Adapter",
    "modelNumberOptions": [
      "FZ1 (B)",
      "FZ1 (S)"
    ],
    "alternateNames": null,
    "variants": null
  },
  "lifecycle": {
    "announcementDate": "2022-07-14",
    "officialDesignations": null
  },
  "officialProductPages": [
    {
      "url": "https://www.stkb.jp/shopdetail/000000001754",
      "pageFamilies": [
        "home-country"
      ],
      "region": "JP",
      "language": "ja",
      "publisher": {
        "type": "manufacturer-or-brand",
        "name": "SHOTEN"
      }
    }
  ],
  "mountConfigurations": [
    {
      "lensSideMountSystemId": "nikon-f",
      "cameraSideMountSystemId": "nikon-z",
      "lensRetention": null,
      "lensRearProtrusionLimits": null
    }
  ],
  "electronics": {
    "electronicContacts": false,
    "autofocus": false,
    "cameraControlledAperture": false,
    "lensStabilizationCommunication": false,
    "manualFocusAssistance": false,
    "metadataTransmission": {
      "present": false
    },
    "lensPowerTransmission": false,
    "recordingTriggerTransmission": false
  },
  "mechanisms": [],
  "physical": {
    "dimensionMeasurements": null,
    "weightMeasurements": [
      {
        "grams": 160,
        "approximate": true,
        "conditions": {}
      }
    ],
    "officialEnvironmentalProtectionClaims": null,
    "tripodSupport": {
      "present": true,
      "components": [
        {
          "type": "body-mounting-point",
          "relationship": "integrated",
          "removable": false,
          "interfaces": [
            {
              "type": "mounting-thread",
              "threadDesignation": null
            }
          ],
          "modelNumberOptions": null,
          "quantity": 1,
          "conditions": {}
        }
      ]
    }
  },
  "electronicServices": null,
  "conversionOptics": {
    "present": false
  }
}
