{
  "$schema": "../../../../schemas/adapters/adapter-record.schema.json",
  "id": "kipon-baveyes-m645-nik-z-0-7x-pro",
  "identity": {
    "manufacturerId": "kipon",
    "brandId": "kipon",
    "productName": "Baveyes Mamiya 645-NIK Z 0.7x PRO Lock Version",
    "modelNumberOptions": [
      "M645-N/Z 0.7x PRO"
    ],
    "alternateNames": null,
    "variants": null
  },
  "lifecycle": {
    "announcementDate": null,
    "officialDesignations": []
  },
  "officialProductPages": [
    {
      "url": "https://www.kipon.jp/products/mamiya-645-nikon-z-0-7x-pro-baveyes-focal-reducer-lock-version",
      "pageFamilies": [
        "japan"
      ],
      "region": "JP",
      "language": "ja",
      "publisher": {
        "type": "manufacturer-or-brand",
        "name": "KIPON"
      }
    }
  ],
  "mountConfigurations": [
    {
      "lensSideMountSystemId": "mamiya-645",
      "cameraSideMountSystemId": "nikon-z",
      "lensRetention": {
        "type": "positive-lock"
      },
      "lensRearProtrusionLimits": null
    }
  ],
  "electronics": {
    "electronicContacts": false,
    "autofocus": false,
    "cameraControlledAperture": false,
    "lensStabilizationCommunication": false,
    "manualFocusAssistance": false,
    "metadataTransmission": {
      "present": false
    },
    "lensPowerTransmission": false,
    "recordingTriggerTransmission": false
  },
  "mechanisms": [],
  "physical": {
    "dimensionMeasurements": null,
    "weightMeasurements": null,
    "officialEnvironmentalProtectionClaims": null,
    "tripodSupport": null
  },
  "electronicServices": null,
  "conversionOptics": {
    "present": true,
    "focalLengthMultiplier": 0.7,
    "apertureChange": {
      "direction": "brighter",
      "stops": 1,
      "relation": "approximately"
    },
    "opticalConstruction": {
      "groups": 3,
      "elements": 5
    },
    "specialElements": null,
    "coatings": null,
    "supportedImageCircleDiameterMm": null,
    "maximumSupportedAperture": null
  }
}
