{
  "$schema": "../../../../schemas/adapters/adapter-record.schema.json",
  "id": "kf-concept-kf06-491",
  "identity": {
    "manufacturerId": "kf-concept",
    "brandId": "kf-concept",
    "productName": "Pentax K DA Lens to Nikon Z Mount Camera Adapter",
    "modelNumberOptions": [
      "KF06.491",
      "KF-DAZ"
    ],
    "alternateNames": null,
    "variants": null
  },
  "lifecycle": {
    "announcementDate": null,
    "officialDesignations": []
  },
  "officialProductPages": [
    {
      "url": "https://www.kentfaith.co.uk/KF06.491_pentax-pk-da-lens-to-nikon-z-series-mount-camera-high-precision-lens-adapter-pk-da-nik-z",
      "pageFamilies": [
        "global"
      ],
      "region": "GB",
      "language": "en",
      "publisher": {
        "type": "manufacturer-or-brand",
        "name": "K&F CONCEPT"
      }
    }
  ],
  "mountConfigurations": [
    {
      "lensSideMountSystemId": "pentax-k",
      "cameraSideMountSystemId": "nikon-z",
      "lensRetention": null,
      "lensRearProtrusionLimits": null
    }
  ],
  "electronics": {
    "electronicContacts": false,
    "autofocus": false,
    "cameraControlledAperture": false,
    "lensStabilizationCommunication": false,
    "manualFocusAssistance": false,
    "metadataTransmission": {
      "present": false
    },
    "lensPowerTransmission": false,
    "recordingTriggerTransmission": false
  },
  "mechanisms": [
    {
      "type": "aperture-ring",
      "conditions": {}
    }
  ],
  "physical": {
    "dimensionMeasurements": null,
    "weightMeasurements": null,
    "officialEnvironmentalProtectionClaims": null,
    "tripodSupport": null
  },
  "electronicServices": null,
  "conversionOptics": {
    "present": false
  }
}
