{
  "$schema": "../../../../schemas/adapters/adapter-record.schema.json",
  "id": "boryoza-if-dkl-nz",
  "identity": {
    "manufacturerId": "boryoza",
    "brandId": "boryoza",
    "productName": "IF·DKL-NZ Chipped Focus Confirm Adapter Voigtländer Bessamatic/Deckel DKL Mount Lens Compatible with Nikon Z Camera",
    "modelNumberOptions": [
      "IF-DKL-NZ",
      "FR11260EMA"
    ],
    "alternateNames": null,
    "variants": null
  },
  "lifecycle": {
    "announcementDate": null,
    "officialDesignations": []
  },
  "officialProductPages": [
    {
      "url": "https://boryoza.net/en/product?slug=if-dkl-nz",
      "pageFamilies": [
        "global"
      ],
      "region": null,
      "language": "en",
      "publisher": {
        "type": "manufacturer-or-brand",
        "name": "BORYOZA"
      }
    }
  ],
  "mountConfigurations": [
    {
      "lensSideMountSystemId": "dkl",
      "cameraSideMountSystemId": "nikon-z",
      "lensRetention": null,
      "lensRearProtrusionLimits": null
    }
  ],
  "electronics": {
    "electronicContacts": true,
    "autofocus": false,
    "cameraControlledAperture": false,
    "lensStabilizationCommunication": false,
    "manualFocusAssistance": true,
    "metadataTransmission": {
      "present": true,
      "standards": [
        "exif"
      ]
    },
    "lensPowerTransmission": null,
    "recordingTriggerTransmission": null
  },
  "mechanisms": null,
  "physical": {
    "dimensionMeasurements": null,
    "weightMeasurements": null,
    "officialEnvironmentalProtectionClaims": null,
    "tripodSupport": null
  },
  "electronicServices": {
    "hasPublishedFirmwareUpdate": true,
    "connections": null
  },
  "conversionOptics": {
    "present": false
  }
}
